{
  "schema_version": 1,
  "modules": [
    {
      "id": "cli",
      "root": "cli",
      "responsibility": "解析 -file 参数与 add、done、list 子命令，输出结果并决定退出状态；不直接读写数据文件。"
    },
    {
      "id": "task",
      "root": "task",
      "responsibility": "承载待办业务规则：标题与截止日期校验、ID 分配不复用、幂等完成、未完成列表排序与数据文档校验；经 storage 持久化。"
    },
    {
      "id": "storage",
      "root": "storage",
      "responsibility": "提供与领域无关的本地 JSON 文档读取与原子写入；仅限单进程，不做多进程互斥。"
    }
  ],
  "interfaces": [
    {
      "id": "cli-command",
      "module_id": "cli",
      "name": "待办命令行接口",
      "description": "提供 add、done、list 子命令与前置 -file 参数。",
      "semantics": {
        "inputs": "[-file 路径] add [-due 日期] 标题 | done ID | list，默认 tasks.json。",
        "outputs": "add 输出 ID、标题与截止日期；list 按截止日期列出未完成任务；成功退出 0。",
        "errors": "参数错误、空白标题、无效日期、未知 ID、文件损坏均非零退出。"
      }
    },
    {
      "id": "task-service",
      "module_id": "task",
      "name": "待办服务接口",
      "description": "提供创建、幂等完成与未完成列表查询。",
      "semantics": {
        "inputs": "数据文件路径，以及标题与可选截止日期，或任务 ID。",
        "outputs": "新任务；完成结果含本次是否变化；按截止日期升序、无日期居后的未完成任务。",
        "errors": "空白标题、无效日期、未知 ID、文档损坏或写入失败；出错时不写文件。"
      }
    },
    {
      "id": "storage-json-document",
      "module_id": "storage",
      "name": "JSON 文档存储接口",
      "description": "完整读取与原子写入 JSON 文档，不解释业务字段。",
      "semantics": {
        "inputs": "文件路径；写入时另给完整 JSON 文档。",
        "outputs": "读取返回文档或「不存在」；写入在原子替换后成功。",
        "errors": "读取失败或 JSON 损坏报错且不覆盖；写入失败不留半写文件。"
      }
    }
  ],
  "forbidden_dependencies": [
    {
      "id": "task-must-not-depend-on-cli",
      "from": "task",
      "to": "cli",
      "reason": "业务规则不得依赖命令行参数与输出。"
    },
    {
      "id": "cli-must-not-depend-on-storage",
      "from": "cli",
      "to": "storage",
      "reason": "cli 只能经 task 使用数据，不得绕过业务校验。"
    },
    {
      "id": "storage-must-not-depend-on-task",
      "from": "storage",
      "to": "task",
      "reason": "storage 保持领域中立，不了解待办模型。"
    },
    {
      "id": "storage-must-not-depend-on-cli",
      "from": "storage",
      "to": "cli",
      "reason": "storage 不依赖命令行细节。"
    }
  ],
  "collaborations": [
    {
      "id": "cli-uses-task-service",
      "from": "cli",
      "interface_id": "task-service",
      "purpose": "把解析后的子命令交给 task 执行业务。"
    },
    {
      "id": "task-uses-storage-json-document",
      "from": "task",
      "interface_id": "storage-json-document",
      "purpose": "每次操作读取文档，状态变化时原子写回。"
    }
  ]
}
